{
  "schema": "gab.thor-node.v1",
  "updatedAt": "2026-08-22T12:30:49Z",
  "node": {
    "id": "THOR",
    "hostLabel": "THOR Contabo VPS 20",
    "stack": "Docker \u00b7 LND Neutrino \u00b7 LNbits \u00b7 satohash-api \u00b7 Hermes",
    "region": "EU Contabo",
    "status": "green",
    "services": [
      {
        "id": "satohash-satohash-api-1",
        "status": "green",
        "detail": "Up 39 hours (healthy)"
      },
      {
        "id": "lnd",
        "status": "green",
        "detail": "Up 2 weeks (healthy)"
      },
      {
        "id": "umami",
        "status": "green",
        "detail": "Up 4 weeks"
      },
      {
        "id": "lnbits",
        "status": "green",
        "detail": "Up 2 weeks"
      },
      {
        "id": "satohash-redis-1",
        "status": "green",
        "detail": "Up 4 weeks"
      },
      {
        "id": "lnbits-postgres",
        "status": "green",
        "detail": "Up 4 weeks (healthy)"
      }
    ]
  },
  "bitcoin": {
    "ok": true,
    "chain": "main",
    "blocks": 963586,
    "headers": 963586,
    "verificationProgress": 1.0,
    "pruned": false,
    "sizeOnDiskGB": 0.34,
    "connections": 0,
    "ibd": false,
    "hint": "LND Neutrino (no local bitcoind). Height + sync from lncli getinfo."
  },
  "lightning": {
    "ok": true,
    "implementation": "lnd",
    "syncedToChain": true,
    "syncedToGraph": true,
    "numPeers": 0,
    "numActiveChannels": 0,
    "numInactiveChannels": 0,
    "numPendingChannels": 0,
    "totalLocalBalanceSats": 0,
    "totalRemoteBalanceSats": 0,
    "totalCapacitySats": 0,
    "aliasPublic": "THOR-GAB",
    "pubkeyPrefix": "0324ccff6c17c9e1",
    "identity_pubkey": "0324ccff6c17c9e13acf22879f6006f59b9a05617c0f607e1d840b4053017cff5b",
    "version": "0.18.3-beta",
    "walletBalanceSats": 6865,
    "hint": "No open channels yet. On-chain wallet 6865 sats (not channel liquidity). Neutrino light client \u2014 height from LND, not bitcoind RPC. Never expose macaroons to HQ HTML."
  },
  "lnbits": {
    "ok": true,
    "hint": "CORS proxy :5103 for hq.giveabit.io"
  },
  "series": [
    {
      "key": "channels_active",
      "label": "Active channels",
      "unit": "n",
      "color": "#1f6b3a",
      "points": [
        {
          "t": "2026-08-21T12:45:01Z",
          "v": 0
        },
        {
          "t": "2026-08-21T13:00:01Z",
          "v": 0
        },
        {
          "t": "2026-08-21T13:15:02Z",
          "v": 0
        },
        {
          "t": "2026-08-21T13:30:02Z",
          "v": 0
        },
        {
          "t": "2026-08-21T13:45:01Z",
          "v": 0
        },
        {
          "t": "2026-08-21T14:00:01Z",
          "v": 0
        },
        {
          "t": "2026-08-21T14:15:01Z",
          "v": 0
        },
        {
          "t": "2026-08-21T14:30:01Z",
          "v": 0
        },
        {
          "t": "2026-08-21T14:45:01Z",
          "v": 0
        },
        {
          "t": "2026-08-21T15:00:01Z",
          "v": 0
        },
        {
          "t": "2026-08-21T15:15:01Z",
          "v": 0
        },
        {
          "t": "2026-08-21T15:30:02Z",
          "v": 0
        },
        {
          "t": "2026-08-21T15:45:01Z",
          "v": 0
        },
        {
          "t": "2026-08-21T16:00:01Z",
          "v": 0
        },
        {
          "t": "2026-08-21T16:15:01Z",
          "v": 0
        },
        {
          "t": "2026-08-21T16:30:02Z",
          "v": 0
        },
        {
          "t": "2026-08-21T16:45:01Z",
          "v": 0
        },
        {
          "t": "2026-08-21T17:00:01Z",
          "v": 0
        },
        {
          "t": "2026-08-21T17:15:01Z",
          "v": 0
        },
        {
          "t": "2026-08-21T17:30:01Z",
          "v": 0
        },
        {
          "t": "2026-08-21T17:45:01Z",
          "v": 0
        },
        {
          "t": "2026-08-21T18:00:01Z",
          "v": 0
        },
        {
          "t": "2026-08-21T18:15:01Z",
          "v": 0
        },
        {
          "t": "2026-08-21T18:30:01Z",
          "v": 0
        },
        {
          "t": "2026-08-21T18:45:01Z",
          "v": 0
        },
        {
          "t": "2026-08-21T19:00:01Z",
          "v": 0
        },
        {
          "t": "2026-08-21T19:15:02Z",
          "v": 0
        },
        {
          "t": "2026-08-21T19:30:02Z",
          "v": 0
        },
        {
          "t": "2026-08-21T19:45:02Z",
          "v": 0
        },
        {
          "t": "2026-08-21T20:00:01Z",
          "v": 0
        },
        {
          "t": "2026-08-21T20:15:01Z",
          "v": 0
        },
        {
          "t": "2026-08-21T20:30:01Z",
          "v": 0
        },
        {
          "t": "2026-08-21T20:45:01Z",
          "v": 0
        },
        {
          "t": "2026-08-21T21:00:01Z",
          "v": 0
        },
        {
          "t": "2026-08-21T21:15:01Z",
          "v": 0
        },
        {
          "t": "2026-08-21T21:30:02Z",
          "v": 0
        },
        {
          "t": "2026-08-21T21:45:01Z",
          "v": 0
        },
        {
          "t": "2026-08-21T22:00:01Z",
          "v": 0
        },
        {
          "t": "2026-08-21T22:15:01Z",
          "v": 0
        },
        {
          "t": "2026-08-21T22:30:01Z",
          "v": 0
        },
        {
          "t": "2026-08-21T22:45:01Z",
          "v": 0
        },
        {
          "t": "2026-08-21T23:00:01Z",
          "v": 0
        },
        {
          "t": "2026-08-21T23:15:01Z",
          "v": 0
        },
        {
          "t": "2026-08-21T23:30:01Z",
          "v": 0
        },
        {
          "t": "2026-08-21T23:45:01Z",
          "v": 0
        },
        {
          "t": "2026-08-22T00:00:01Z",
          "v": 0
        },
        {
          "t": "2026-08-22T00:15:01Z",
          "v": 0
        },
        {
          "t": "2026-08-22T00:30:02Z",
          "v": 0
        },
        {
          "t": "2026-08-22T00:45:01Z",
          "v": 0
        },
        {
          "t": "2026-08-22T01:00:01Z",
          "v": 0
        },
        {
          "t": "2026-08-22T01:15:01Z",
          "v": 0
        },
        {
          "t": "2026-08-22T01:30:02Z",
          "v": 0
        },
        {
          "t": "2026-08-22T01:45:01Z",
          "v": 0
        },
        {
          "t": "2026-08-22T02:00:01Z",
          "v": 0
        },
        {
          "t": "2026-08-22T02:15:01Z",
          "v": 0
        },
        {
          "t": "2026-08-22T02:30:01Z",
          "v": 0
        },
        {
          "t": "2026-08-22T02:45:01Z",
          "v": 0
        },
        {
          "t": "2026-08-22T03:00:02Z",
          "v": 0
        },
        {
          "t": "2026-08-22T03:15:01Z",
          "v": 0
        },
        {
          "t": "2026-08-22T03:30:01Z",
          "v": 0
        },
        {
          "t": "2026-08-22T03:45:01Z",
          "v": 0
        },
        {
          "t": "2026-08-22T04:00:01Z",
          "v": 0
        },
        {
          "t": "2026-08-22T04:15:01Z",
          "v": 0
        },
        {
          "t": "2026-08-22T04:30:02Z",
          "v": 0
        },
        {
          "t": "2026-08-22T04:45:01Z",
          "v": 0
        },
        {
          "t": "2026-08-22T05:00:02Z",
          "v": 0
        },
        {
          "t": "2026-08-22T05:15:01Z",
          "v": 0
        },
        {
          "t": "2026-08-22T05:30:01Z",
          "v": 0
        },
        {
          "t": "2026-08-22T05:45:01Z",
          "v": 0
        },
        {
          "t": "2026-08-22T06:00:01Z",
          "v": 0
        },
        {
          "t": "2026-08-22T06:15:02Z",
          "v": 0
        },
        {
          "t": "2026-08-22T06:30:01Z",
          "v": 0
        },
        {
          "t": "2026-08-22T06:45:01Z",
          "v": 0
        },
        {
          "t": "2026-08-22T07:00:01Z",
          "v": 0
        },
        {
          "t": "2026-08-22T07:15:01Z",
          "v": 0
        },
        {
          "t": "2026-08-22T07:30:01Z",
          "v": 0
        },
        {
          "t": "2026-08-22T07:45:01Z",
          "v": 0
        },
        {
          "t": "2026-08-22T08:00:01Z",
          "v": 0
        },
        {
          "t": "2026-08-22T08:15:01Z",
          "v": 0
        },
        {
          "t": "2026-08-22T08:30:01Z",
          "v": 0
        },
        {
          "t": "2026-08-22T08:45:01Z",
          "v": 0
        },
        {
          "t": "2026-08-22T09:00:01Z",
          "v": 0
        },
        {
          "t": "2026-08-22T09:15:01Z",
          "v": 0
        },
        {
          "t": "2026-08-22T09:30:01Z",
          "v": 0
        },
        {
          "t": "2026-08-22T09:45:01Z",
          "v": 0
        },
        {
          "t": "2026-08-22T10:00:01Z",
          "v": 0
        },
        {
          "t": "2026-08-22T10:15:01Z",
          "v": 0
        },
        {
          "t": "2026-08-22T10:30:01Z",
          "v": 0
        },
        {
          "t": "2026-08-22T10:45:01Z",
          "v": 0
        },
        {
          "t": "2026-08-22T11:00:01Z",
          "v": 0
        },
        {
          "t": "2026-08-22T11:15:02Z",
          "v": 0
        },
        {
          "t": "2026-08-22T11:30:01Z",
          "v": 0
        },
        {
          "t": "2026-08-22T11:45:01Z",
          "v": 0
        },
        {
          "t": "2026-08-22T12:00:02Z",
          "v": 0
        },
        {
          "t": "2026-08-22T12:15:01Z",
          "v": 0
        },
        {
          "t": "2026-08-22T12:30:01Z",
          "v": 0
        }
      ]
    },
    {
      "key": "local_sats",
      "label": "Local balance",
      "unit": "sats",
      "color": "#c45f00",
      "points": [
        {
          "t": "2026-08-21T12:45:01Z",
          "v": 0
        },
        {
          "t": "2026-08-21T13:00:01Z",
          "v": 0
        },
        {
          "t": "2026-08-21T13:15:02Z",
          "v": 0